{
  "$schema": "https://json-schema.org/draft/2020-12/schema",
  "$id": "xdebug.stream.query.response.v1",
  "title": "stream.query response",
  "type": "object",
  "required": [
    "api_version",
    "ok",
    "action",
    "summary",
    "data"
  ],
  "properties": {
    "api_version": {
      "type": "string",
      "enum": [
        "xdebug.v1"
      ]
    },
    "ok": {
      "type": "boolean"
    },
    "action": {
      "type": "string",
      "enum": [
        "stream.query"
      ]
    },
    "summary": {
      "type": "object"
    },
    "data": {
      "type": "object"
    },
    "error": {},
    "warnings": {
      "type": "array"
    },
    "meta": {
      "type": "object"
    }
  },
  "additionalProperties": true,
  "description": "Query and filter stream transfers, stalls, and packets with explicit full or range base-cache scope.",
  "x-output_notes": "返回该 action 的 summary/data/error/meta；具体字段以 response schema 和 response example 为准。",
  "x-description-zh": "以显式 full 或 range 基础分析缓存范围查询并按多个字段过滤 stream transfer 或 packet。"
}
