{
  "api_version": "xdebug.v1",
  "ok": true,
  "action": "stream.query",
  "summary": {
    "stream": "req_stream",
    "transfer_count": 128,
    "stall_cycles": 4,
    "complete_packet_count": 16,
    "partial_packet_count": 0,
    "packet_count_status": "exact",
    "filter_applied": false,
    "truncated": false
  },
  "data": {
    "query": "summary"
  }
}
